{
  "$schema": "https://json-schema.org/draft/2020-12/schema",
  "$id": "urn:embedproof:schema:report:v1",
  "title": "EmbedProof emissions report v1",
  "description": "Operator report for one installation and month (docs/INTERFACES.md section 4). This schema covers the structure and ranges that attestor/report.py enforces. Rules that need other data are NOT expressible here and are enforced by the attestor only: indirectEmissionsTco2 within 1% of electricityMwh x gridFactorTco2PerMwh; seeTco2PerT within 1% of (directEmissionsTco2 + indirectEmissionsTco2) / productionTonnes; route equal to the on-chain registry route; productionTonnes at most the on-chain nameplate capacity / 12 x 1.2; period not later than the current UTC month; the installation being registered. Numbers must be JSON numbers no larger than 2^53 - 1 (RFC 8785 / JavaScript interoperability).",
  "type": "object",
  "additionalProperties": false,
  "required": [
    "schema",
    "installationId",
    "period",
    "route",
    "cnCode",
    "productionTonnes",
    "directEmissionsTco2",
    "electricityMwh",
    "gridFactorTco2PerMwh",
    "indirectEmissionsTco2",
    "seeTco2PerT"
  ],
  "properties": {
    "schema": { "const": "embedproof.report.v1" },
    "installationId": {
      "description": "Installation id as registered on-chain (ASCII, right-padded to bytes32).",
      "type": "string",
      "pattern": "^[A-Za-z0-9_-]{1,32}$"
    },
    "period": {
      "description": "Reporting month YYYY-MM, years 2000-2100.",
      "type": "string",
      "pattern": "^(20[0-9]{2}|2100)-(0[1-9]|1[0-2])$"
    },
    "route": { "enum": ["BF-BOF", "EAF", "DRI-EAF", "CEMENT-DRY", "CEMENT-WET"] },
    "cnCode": {
      "description": "CBAM Combined Nomenclature code, 4 to 8 digits.",
      "type": "string",
      "pattern": "^[0-9]{4,8}$"
    },
    "productionTonnes": {
      "description": "Tonnes of product in the period; whole tonnes are attested, so at least 1.",
      "type": "number",
      "minimum": 1,
      "maximum": 9007199254740991
    },
    "directEmissionsTco2": { "type": "number", "minimum": 0, "maximum": 9007199254740991 },
    "electricityMwh": { "type": "number", "minimum": 0, "maximum": 9007199254740991 },
    "gridFactorTco2PerMwh": { "type": "number", "minimum": 0, "maximum": 9007199254740991 },
    "indirectEmissionsTco2": { "type": "number", "minimum": 0, "maximum": 9007199254740991 },
    "seeTco2PerT": {
      "description": "Specific embedded emissions, tCO2 per tonne of product. round(see x 1e4) is stored as a uint32 on-chain, so it must stay below 429496.7296.",
      "type": "number",
      "minimum": 0,
      "exclusiveMaximum": 429496.7296
    }
  }
}
