{
  "schema": "embedproof.report.v1",
  "installationId": "TR-EAF-0001",
  "period": "2026-10",
  "route": "EAF",
  "cnCode": "72142000",
  "productionTonnes": 4800,
  "directEmissionsTco2": 912.0,
  "electricityMwh": 2160.0,
  "gridFactorTco2PerMwh": 0.476,
  "indirectEmissionsTco2": 1028.16,
  "seeTco2PerT": 0.404
}
